[
  {
    "state": "Lagos",
    "state_code": "LA",
    "lga": "Lagos Mainland",
    "ward": "Yaba",
    "neighbourhoods": ["Yaba", "Ojuelegba", "Tejuosho", "Alagomeji", "Onipanu"],
    "nicknames": ["Yaba", "Ojuelegba axis", "Mainland"],
    "centroid": { "lat": 6.5095, "lng": 3.3711 },
    "is_city": false,
    "source_ref": "OSM-Lagos-Mainland"
  },
  {
    "state": "Lagos",
    "state_code": "LA",
    "lga": "Eti-Osa",
    "ward": "Victoria Island",
    "neighbourhoods": ["Victoria Island", "Oniru", "Maroko", "Ajah"],
    "nicknames": ["VI", "V.I.", "Victoria Island"],
    "centroid": { "lat": 6.4281, "lng": 3.4219 },
    "is_city": false,
    "source_ref": "OSM-Eti-Osa"
  },
  {
    "state": "Lagos",
    "state_code": "LA",
    "lga": "Eti-Osa",
    "ward": "Lekki",
    "neighbourhoods": ["Lekki Phase 1", "Lekki Phase 2", "Ikate", "Chevron", "Awoyaya"],
    "nicknames": ["Lekki", "Lekki 1", "Lekki 2"],
    "centroid": { "lat": 6.4478, "lng": 3.4723 },
    "is_city": false,
    "source_ref": "OSM-Eti-Osa"
  },
  {
    "state": "Lagos",
    "state_code": "LA",
    "lga": "Ikeja",
    "ward": "Ikeja GRA",
    "neighbourhoods": ["Ikeja GRA", "Opebi", "Allen", "Alausa", "Computer Village"],
    "nicknames": ["GRA", "Ikeja GRA", "Computer Village", "Otigba"],
    "centroid": { "lat": 6.5876, "lng": 3.3431 },
    "is_city": false,
    "source_ref": "OSM-Ikeja"
  },
  {
    "state": "Lagos",
    "state_code": "LA",
    "lga": "Surulere",
    "ward": "Surulere",
    "neighbourhoods": ["Surulere", "Aguda", "Iponri", "Bode Thomas", "Adeniran Ogunsanya"],
    "nicknames": ["Suru", "Surulere"],
    "centroid": { "lat": 6.4969, "lng": 3.3481 },
    "is_city": false,
    "source_ref": "OSM-Surulere"
  },
  {
    "state": "Lagos",
    "state_code": "LA",
    "lga": "Agege",
    "ward": "Agege",
    "neighbourhoods": ["Agege", "Dopemu", "Iju", "Ifako"],
    "nicknames": ["Agege"],
    "centroid": { "lat": 6.6277, "lng": 3.3166 },
    "is_city": false,
    "source_ref": "OSM-Agege"
  },
  {
    "state": "Lagos",
    "state_code": "LA",
    "lga": "Amuwo-Odofin",
    "ward": "Festac Town",
    "neighbourhoods": ["Festac Town", "Amuwo", "Okokomaiko"],
    "nicknames": ["Festac", "Festac Town"],
    "centroid": { "lat": 6.4737, "lng": 3.2849 },
    "is_city": false,
    "source_ref": "OSM-Amuwo-Odofin"
  },
  {
    "state": "Lagos",
    "state_code": "LA",
    "lga": "Mushin",
    "ward": "Mushin",
    "neighbourhoods": ["Mushin", "Idi-Oro", "Olosha", "Papa Ajao"],
    "nicknames": ["Mushin"],
    "centroid": { "lat": 6.5374, "lng": 3.3611 },
    "is_city": false,
    "source_ref": "OSM-Mushin"
  },
  {
    "state": "Lagos",
    "state_code": "LA",
    "lga": "Eti-Osa",
    "ward": "Elegushi",
    "neighbourhoods": ["Elegushi Beach", "Ikota", "Lekki-Epe Expressway"],
    "nicknames": ["Elegushi", "Elegushi Beach"],
    "centroid": { "lat": 6.442, "lng": 3.479 },
    "is_city": false,
    "source_ref": "OSM-Eti-Osa"
  },
  {
    "state": "Abuja",
    "state_code": "FC",
    "lga": "AMAC",
    "ward": "Wuse",
    "neighbourhoods": ["Wuse 2", "Wuse Zone 3", "Aminu Kano Crescent", "Herbert Macaulay Way"],
    "nicknames": ["Wuse", "Wuse 2", "Zone 3"],
    "centroid": { "lat": 9.0873, "lng": 7.3815 },
    "is_city": false,
    "source_ref": "OSM-AMAC"
  },
  {
    "state": "Abuja",
    "state_code": "FC",
    "lga": "AMAC",
    "ward": "Garki",
    "neighbourhoods": ["Garki", "Area 1", "Area 2", "Area 3", "Area 10", "Area 11"],
    "nicknames": ["Garki", "Area 1", "Area 10"],
    "centroid": { "lat": 9.071, "lng": 7.489 },
    "is_city": false,
    "source_ref": "OSM-AMAC"
  },
  {
    "state": "Abuja",
    "state_code": "FC",
    "lga": "AMAC",
    "ward": "Maitama",
    "neighbourhoods": ["Maitama", "Asokoro", "Wuse Zone 6", "Ministers Hill"],
    "nicknames": ["Maitama", "Asokoro"],
    "centroid": { "lat": 9.0893, "lng": 7.4875 },
    "is_city": false,
    "source_ref": "OSM-AMAC"
  },
  {
    "state": "Abuja",
    "state_code": "FC",
    "lga": "AMAC",
    "ward": "Asokoro",
    "neighbourhoods": ["Asokoro", "The Presidency", "ECOWAS", "Guzape"],
    "nicknames": ["Asokoro"],
    "centroid": { "lat": 9.0469, "lng": 7.4892 },
    "is_city": false,
    "source_ref": "OSM-AMAC"
  },
  {
    "state": "Abuja",
    "state_code": "FC",
    "lga": "AMAC",
    "ward": "Utako",
    "neighbourhoods": ["Utako", "Jabi", "Kado", "Kubwa"],
    "nicknames": ["Utako", "Jabi"],
    "centroid": { "lat": 9.0844, "lng": 7.4345 },
    "is_city": false,
    "source_ref": "OSM-AMAC"
  },
  {
    "state": "Abuja",
    "state_code": "FC",
    "lga": "AMAC",
    "ward": "Wuse Market",
    "neighbourhoods": ["Wuse Market", "Wuse Zone 6", "Wuse Zone 5"],
    "nicknames": ["Wuse Market", "Zone 6 Market"],
    "centroid": { "lat": 9.0867, "lng": 7.3891 },
    "is_city": false,
    "source_ref": "OSM-AMAC"
  },
  {
    "state": "Abuja",
    "state_code": "FC",
    "lga": "AMAC",
    "ward": "Gwarinpa",
    "neighbourhoods": ["Gwarinpa", "Karsana", "Dakibiyu", "Katimbo"],
    "nicknames": ["Gwarinpa", "Gwarinpa Estate"],
    "centroid": { "lat": 9.092, "lng": 7.38 },
    "is_city": false,
    "source_ref": "OSM-AMAC"
  },
  {
    "state": "Abuja",
    "state_code": "FC",
    "lga": "AMAC",
    "ward": "Central Business District",
    "neighbourhoods": ["CBD", "Three Arms Zone", "Federal Secretariat", "Eagle Square"],
    "nicknames": ["CBD", "Three Arms Zone"],
    "centroid": { "lat": 9.0566, "lng": 7.4019 },
    "is_city": false,
    "source_ref": "OSM-AMAC"
  },
  {
    "state": "Port Harcourt",
    "state_code": "RV",
    "lga": "Port Harcourt City",
    "ward": "GRA Phase 2",
    "neighbourhoods": ["GRA Phase 2", "GRA Phase 1", "Old GRA", "New GRA"],
    "nicknames": ["GRA", "GRA Phase 2", "Old GRA"],
    "centroid": { "lat": 4.813, "lng": 7.027 },
    "is_city": false,
    "source_ref": "OSM-PH-City"
  },
  {
    "state": "Port Harcourt",
    "state_code": "RV",
    "lga": "Port Harcourt City",
    "ward": "Trans Amadi",
    "neighbourhoods": ["Trans Amadi", "Elelenwo", "Woji", "Rumuokwurusi"],
    "nicknames": ["Trans Amadi", "Trans-Amadi"],
    "centroid": { "lat": 4.837, "lng": 7.018 },
    "is_city": false,
    "source_ref": "OSM-PH-City"
  },
  {
    "state": "Port Harcourt",
    "state_code": "RV",
    "lga": "Port Harcourt City",
    "ward": "Peter Odili Road",
    "neighbourhoods": ["Peter Odili Road", "Rumuigbo", "Rumuosi", "NTA Road"],
    "nicknames": ["Peter Odili", "Odili Road"],
    "centroid": { "lat": 4.834, "lng": 7.02 },
    "is_city": false,
    "source_ref": "OSM-PH-City"
  },
  {
    "state": "Port Harcourt",
    "state_code": "RV",
    "lga": "Obio-Akpor",
    "ward": "Rumuola",
    "neighbourhoods": ["Rumuola", "Rumuokoro", "Rumuodomaya", "Artillery"],
    "nicknames": ["Rumuola", "Artillery"],
    "centroid": { "lat": 4.8356, "lng": 7.0421 },
    "is_city": false,
    "source_ref": "OSM-Obio-Akpor"
  },
  {
    "state": "Ibadan",
    "state_code": "OY",
    "lga": "Ibadan North",
    "ward": "UI Campus",
    "neighbourhoods": ["UI Campus", "Sango", "Samonda", "Agbowo"],
    "nicknames": ["UI", "University of Ibadan", "Campus"],
    "centroid": { "lat": 7.4447, "lng": 3.9 },
    "is_city": false,
    "source_ref": "OSM-Ibadan-North"
  },
  {
    "state": "Ibadan",
    "state_code": "OY",
    "lga": "Ibadan North",
    "ward": "Dugbe",
    "neighbourhoods": ["Dugbe", "Cocoa House", "Molete", "Challenge"],
    "nicknames": ["Dugbe", "Cocoa House", "Challenge"],
    "centroid": { "lat": 7.3775, "lng": 3.901 },
    "is_city": false,
    "source_ref": "OSM-Ibadan-North"
  },
  {
    "state": "Ibadan",
    "state_code": "OY",
    "lga": "Ibadan South West",
    "ward": "Bodija",
    "neighbourhoods": ["New Bodija", "Old Bodija", "UI Second Gate", "Sango UI"],
    "nicknames": ["Bodija", "New Bodija"],
    "centroid": { "lat": 7.417, "lng": 3.887 },
    "is_city": false,
    "source_ref": "OSM-Ibadan-SW"
  },
  {
    "state": "Ibadan",
    "state_code": "OY",
    "lga": "Ibadan North",
    "ward": "Jericho",
    "neighbourhoods": ["Jericho GRA", "Jericho", "Oke Ado", "Iyaganku"],
    "nicknames": ["Jericho", "Jericho GRA", "Iyaganku"],
    "centroid": { "lat": 7.386, "lng": 3.88 },
    "is_city": false,
    "source_ref": "OSM-Ibadan-North"
  },
  {
    "state": "Enugu",
    "state_code": "EN",
    "lga": "Enugu North",
    "ward": "Independence Layout",
    "neighbourhoods": ["Independence Layout", "GRA Enugu", "New Haven", "Coal Camp"],
    "nicknames": ["Indep", "Independence Layout", "GRA"],
    "centroid": { "lat": 6.4537, "lng": 7.5414 },
    "is_city": false,
    "source_ref": "OSM-Enugu-North"
  },
  {
    "state": "Enugu",
    "state_code": "EN",
    "lga": "Enugu North",
    "ward": "New Haven",
    "neighbourhoods": ["New Haven", "Ogui", "Uwani", "Achara Layout"],
    "nicknames": ["New Haven"],
    "centroid": { "lat": 6.455, "lng": 7.535 },
    "is_city": false,
    "source_ref": "OSM-Enugu-North"
  },
  {
    "state": "Enugu",
    "state_code": "EN",
    "lga": "Enugu East",
    "ward": "Trans Ekulu",
    "neighbourhoods": ["Trans Ekulu", "Emene", "Nike", "Abakpa"],
    "nicknames": ["Trans Ekulu", "Emene"],
    "centroid": { "lat": 6.4745, "lng": 7.548 },
    "is_city": false,
    "source_ref": "OSM-Enugu-East"
  },
  {
    "state": "Enugu",
    "state_code": "EN",
    "lga": "Enugu North",
    "ward": "Ogige Market",
    "neighbourhoods": ["Ogige Market", "Ogbete", "Artisan", "Kenya"],
    "nicknames": ["Ogige", "Ogige Market", "Ogbete"],
    "centroid": { "lat": 6.449, "lng": 7.51 },
    "is_city": false,
    "source_ref": "OSM-Enugu-North"
  },
  {
    "state": "Kano",
    "state_code": "KN",
    "lga": "Kano Municipal",
    "ward": "Sultan Road",
    "neighbourhoods": ["Sultan Road", "Nassarawa GRA", "Bompai", "Tarauni"],
    "nicknames": ["Sultan Road", "Nasarawa", "Bompai"],
    "centroid": { "lat": 11.998, "lng": 8.518 },
    "is_city": false,
    "source_ref": "OSM-Kano-Municipal"
  },
  {
    "state": "Kano",